<Payload xmlns="http://javaops.ru"
         xmlns:xsi="http://www.w3.org/2001/XMLSchema-instance"
         xsi:schemaLocation="http://javaops.ru payload.xsd">
    <Projects>
        <Project name="topjava">
            <description>TopJava Project</description>
            <Groups>
                <Group name="topjava01" groupType="FINISHED"/>
                <Group name="topjava02" groupType="CURRENT"/>
                <Group name="topjava03" groupType="REGISTERING"/>
            </Groups>
        </Project>
        <Project name="masterjava">
            <description>MasterJava Project</description>
            <Groups>
                <Group name="masterjava01" groupType="CURRENT"/>
                <Group name="masterjava02" groupType="REGISTERING"/>
            </Groups>
        </Project>
    </Projects>
    <Cities>
        <City id="spb">Санкт-Петербург</City>
        <City id="kiv">Киев</City>
        <City id="mnsk">Минск</City>
    </Cities>
    <Users>
        <User flag="active" city="kiv" email="gmail1@gmail.com" groups="topjava02">User</User>
        <User flag="active" city="kiv" email="gmail2@gmail.com" groups="topjava01">User</User>
        <User flag="superuser" city="spb" email="admin@javaops.ru" groups="topjava03">Admin</User>
        <User flag="deleted" city="spb" email="mail@yandex.ru">Deleted</User>
    </Users>
</Payload>